<?xml version="1.0" encoding="utf-8"?>
<year xmlns="http://www.example.com/year" xsi:schemaLocation="http://www.example.com/year schema.xsd" xmlns:xsi="http://www.w3.org/2001/XMLSchema-instance">
  <month>
    <monthName>March</monthName>
    <day>
      <dayNumber>5</dayNumber>
      <temperature>13</temperature>
    </day>
    <day>
      <dayNumber>13</dayNumber>
      <temperature>-16</temperature>
    </day>
    <day>
      <dayNumber>10</dayNumber>
      <temperature>-8</temperature>
    </day>
    <day>
      <dayNumber>28</dayNumber>
      <temperature>4</temperature>
    </day>
    <day>
      <dayNumber>31</dayNumber>
      <temperature>21</temperature>
    </day>
    <day>
      <dayNumber>27</dayNumber>
      <temperature>14</temperature>
    </day>
    <day>
      <dayNumber>7</dayNumber>
      <temperature>-21</temperature>
    </day>
    <day>
      <dayNumber>13</dayNumber>
      <temperature>-1</temperature>
    </day>
    <day>
      <dayNumber>23</dayNumber>
      <temperature>7</temperature>
    </day>
    <day>
      <dayNumber>30</dayNumber>
      <temperature>-13</temperature>
    </day>
    <day>
      <dayNumber>15</dayNumber>
      <temperature>-20</temperature>
    </day>
    <day>
      <dayNumber>23</dayNumber>
      <temperature>-15</temperature>
    </day>
    <day>
      <dayNumber>20</dayNumber>
      <temperature>-28</temperature>
    </day>
    <day>
      <dayNumber>4</dayNumber>
      <temperature>23</temperature>
    </day>
    <day>
      <dayNumber>18</dayNumber>
      <temperature>-26</temperature>
    </day>
    <day>
      <dayNumber>6</dayNumber>
      <temperature>5</temperature>
    </day>
    <day>
      <dayNumber>11</dayNumber>
      <temperature>-29</temperature>
    </day>
    <day>
      <dayNumber>20</dayNumber>
      <temperature>-2</temperature>
    </day>
    <day>
      <dayNumber>29</dayNumber>
      <temperature>21</temperature>
    </day>
    <day>
      <dayNumber>19</dayNumber>
      <temperature>-7</temperature>
    </day>
    <day>
      <dayNumber>23</dayNumber>
      <temperature>21</temperature>
    </day>
    <day>
      <dayNumber>22</dayNumber>
      <temperature>-12</temperature>
    </day>
    <day>
      <dayNumber>29</dayNumber>
      <temperature>16</temperature>
    </day>
    <day>
      <dayNumber>5</dayNumber>
      <temperature>27</temperature>
    </day>
    <day>
      <dayNumber>3</dayNumber>
      <temperature>25</temperature>
    </day>
    <day>
      <dayNumber>15</dayNumber>
      <temperature>24</temperature>
    </day>
    <day>
      <dayNumber>12</dayNumber>
      <temperature>-4</temperature>
    </day>
    <day>
      <dayNumber>20</dayNumber>
      <temperature>21</temperature>
    </day>
    <day>
      <dayNumber>6</dayNumber>
      <temperature>25</temperature>
    </day>
    <day>
      <dayNumber>2</dayNumber>
      <temperature>10</temperature>
    </day>
  </month>
  <month>
    <monthName>June</monthName>
    <day>
      <dayNumber>1</dayNumber>
      <temperature>-25</temperature>
    </day>
    <day>
      <dayNumber>25</dayNumber>
      <temperature>-12</temperature>
    </day>
    <day>
      <dayNumber>16</dayNumber>
      <temperature>-21</temperature>
    </day>
    <day>
      <dayNumber>16</dayNumber>
      <temperature>-5</temperature>
    </day>
    <day>
      <dayNumber>10</dayNumber>
      <temperature>-11</temperature>
    </day>
    <day>
      <dayNumber>5</dayNumber>
      <temperature>15</temperature>
    </day>
    <day>
      <dayNumber>17</dayNumber>
      <temperature>14</temperature>
    </day>
    <day>
      <dayNumber>27</dayNumber>
      <temperature>-13</temperature>
    </day>
    <day>
      <dayNumber>18</dayNumber>
      <temperature>25</temperature>
    </day>
    <day>
      <dayNumber>19</dayNumber>
      <temperature>-18</temperature>
    </day>
    <day>
      <dayNumber>9</dayNumber>
      <temperature>5</temperature>
    </day>
    <day>
      <dayNumber>6</dayNumber>
      <temperature>-29</temperature>
    </day>
    <day>
      <dayNumber>18</dayNumber>
      <temperature>-26</temperature>
    </day>
    <day>
      <dayNumber>21</dayNumber>
      <temperature>-7</temperature>
    </day>
    <day>
      <dayNumber>29</dayNumber>
      <temperature>27</temperature>
    </day>
    <day>
      <dayNumber>27</dayNumber>
      <temperature>12</temperature>
    </day>
    <day>
      <dayNumber>30</dayNumber>
      <temperature>28</temperature>
    </day>
    <day>
      <dayNumber>4</dayNumber>
      <temperature>-10</temperature>
    </day>
    <day>
      <dayNumber>14</dayNumber>
      <temperature>-14</temperature>
    </day>
    <day>
      <dayNumber>22</dayNumber>
      <temperature>26</temperature>
    </day>
    <day>
      <dayNumber>27</dayNumber>
      <temperature>-5</temperature>
    </day>
    <day>
      <dayNumber>9</dayNumber>
      <temperature>4</temperature>
    </day>
    <day>
      <dayNumber>9</dayNumber>
      <temperature>-18</temperature>
    </day>
    <day>
      <dayNumber>17</dayNumber>
      <temperature>-25</temperature>
    </day>
    <day>
      <dayNumber>14</dayNumber>
      <temperature>-23</temperature>
    </day>
    <day>
      <dayNumber>13</dayNumber>
      <temperature>-4</temperature>
    </day>
    <day>
      <dayNumber>16</dayNumber>
      <temperature>10</temperature>
    </day>
    <day>
      <dayNumber>6</dayNumber>
      <temperature>10</temperature>
    </day>
    <day>
      <dayNumber>20</dayNumber>
      <temperature>11</temperature>
    </day>
    <day>
      <dayNumber>22</dayNumber>
      <temperature>-15</temperature>
    </day>
  </month>
  <month>
    <monthName>May</monthName>
    <day>
      <dayNumber>16</dayNumber>
      <temperature>-21</temperature>
    </day>
    <day>
      <dayNumber>19</dayNumber>
      <temperature>28</temperature>
    </day>
    <day>
      <dayNumber>9</dayNumber>
      <temperature>26</temperature>
    </day>
    <day>
      <dayNumber>28</dayNumber>
      <temperature>-3</temperature>
    </day>
    <day>
      <dayNumber>23</dayNumber>
      <temperature>1</temperature>
    </day>
    <day>
      <dayNumber>3</dayNumber>
      <temperature>23</temperature>
    </day>
    <day>
      <dayNumber>7</dayNumber>
      <temperature>8</temperature>
    </day>
    <day>
      <dayNumber>16</dayNumber>
      <temperature>-4</temperature>
    </day>
    <day>
      <dayNumber>19</dayNumber>
      <temperature>-25</temperature>
    </day>
    <day>
      <dayNumber>14</dayNumber>
      <temperature>-12</temperature>
    </day>
    <day>
      <dayNumber>19</dayNumber>
      <temperature>-29</temperature>
    </day>
    <day>
      <dayNumber>25</dayNumber>
      <temperature>-20</temperature>
    </day>
    <day>
      <dayNumber>5</dayNumber>
      <temperature>-14</temperature>
    </day>
    <day>
      <dayNumber>1</dayNumber>
      <temperature>18</temperature>
    </day>
    <day>
      <dayNumber>14</dayNumber>
      <temperature>14</temperature>
    </day>
    <day>
      <dayNumber>1</dayNumber>
      <temperature>-27</temperature>
    </day>
    <day>
      <dayNumber>21</dayNumber>
      <temperature>-21</temperature>
    </day>
    <day>
      <dayNumber>12</dayNumber>
      <temperature>-4</temperature>
    </day>
    <day>
      <dayNumber>11</dayNumber>
      <temperature>4</temperature>
    </day>
    <day>
      <dayNumber>14</dayNumber>
      <temperature>12</temperature>
    </day>
    <day>
      <dayNumber>25</dayNumber>
      <temperature>27</temperature>
    </day>
    <day>
      <dayNumber>25</dayNumber>
      <temperature>-16</temperature>
    </day>
    <day>
      <dayNumber>6</dayNumber>
      <temperature>-20</temperature>
    </day>
    <day>
      <dayNumber>30</dayNumber>
      <temperature>4</temperature>
    </day>
    <day>
      <dayNumber>24</dayNumber>
      <temperature>-27</temperature>
    </day>
    <day>
      <dayNumber>5</dayNumber>
      <temperature>25</temperature>
    </day>
    <day>
      <dayNumber>18</dayNumber>
      <temperature>1</temperature>
    </day>
    <day>
      <dayNumber>2</dayNumber>
      <temperature>13</temperature>
    </day>
    <day>
      <dayNumber>9</dayNumber>
      <temperature>-11</temperature>
    </day>
    <day>
      <dayNumber>7</dayNumber>
      <temperature>8</temperature>
    </day>
  </month>
  <month>
    <monthName>July</monthName>
    <day>
      <dayNumber>20</dayNumber>
      <temperature>-6</temperature>
    </day>
    <day>
      <dayNumber>19</dayNumber>
      <temperature>-17</temperature>
    </day>
    <day>
      <dayNumber>9</dayNumber>
      <temperature>-22</temperature>
    </day>
    <day>
      <dayNumber>24</dayNumber>
      <temperature>-3</temperature>
    </day>
    <day>
      <dayNumber>24</dayNumber>
      <temperature>12</temperature>
    </day>
    <day>
      <dayNumber>1</dayNumber>
      <temperature>-12</temperature>
    </day>
    <day>
      <dayNumber>21</dayNumber>
      <temperature>3</temperature>
    </day>
    <day>
      <dayNumber>15</dayNumber>
      <temperature>-13</temperature>
    </day>
    <day>
      <dayNumber>3</dayNumber>
      <temperature>20</temperature>
    </day>
    <day>
      <dayNumber>19</dayNumber>
      <temperature>19</temperature>
    </day>
    <day>
      <dayNumber>5</dayNumber>
      <temperature>-28</temperature>
    </day>
    <day>
      <dayNumber>24</dayNumber>
      <temperature>-3</temperature>
    </day>
    <day>
      <dayNumber>31</dayNumber>
      <temperature>-29</temperature>
    </day>
    <day>
      <dayNumber>10</dayNumber>
      <temperature>-11</temperature>
    </day>
    <day>
      <dayNumber>30</dayNumber>
      <temperature>14</temperature>
    </day>
    <day>
      <dayNumber>30</dayNumber>
      <temperature>-19</temperature>
    </day>
    <day>
      <dayNumber>1</dayNumber>
      <temperature>24</temperature>
    </day>
    <day>
      <dayNumber>8</dayNumber>
      <temperature>23</temperature>